{"inputs":[{"blake3":"a200d36403ac7c1eea5934230008b028a8d036ba832ac839f1c4aef8caf26a0c","path":"/private/tmp/rosalind-roadmap-validation/curve-final/cache/ee277da394abeff482ea24ef024eeafd9027988c8d589420e84d93c123a771f0/c00000000-p0000000000/manifest.json"},{"blake3":"90dad59e6428458743425c740c94d252a9277c7aafc3512315139f096be4dfa4","path":"/private/tmp/rosalind-roadmap-validation/curve-final/cache/ee277da394abeff482ea24ef024eeafd9027988c8d589420e84d93c123a771f0/c00000001-p0000000000/manifest.json"}],"outputs":[{"blake3":"5bb04312f7735c6e0815a3b774211da934bf2be452ba1f6348417bf74359db85","path":"/private/tmp/rosalind-roadmap-validation/curve-final/cache/ee277da394abeff482ea24ef024eeafd9027988c8d589420e84d93c123a771f0/c00000000-p0000000000/evidence.arrow"},{"blake3":"d2640e72f61c853db375bc4270caae2eae7637c6ab8c990f6f5ea1cfd0fec955","path":"/private/tmp/rosalind-roadmap-validation/curve-final/cache/ee277da394abeff482ea24ef024eeafd9027988c8d589420e84d93c123a771f0/c00000001-p0000000000/evidence.arrow"}],"params":{"code_dirty":"true","code_git_sha":"d6b40019a24912ebdd786f59638b4edc20c41a27","dataset.partition_bases":"16384","dataset.partition_count":"2","dataset.request_blake3":"a9558c525142a837812bd778a92258e9c1bb52b135fe0e948e30045b2e8553b2","deps_lock_blake3":"d5f99c71ceb53d5c99a644c9dcd6b9c90588a9318d9e449f7bb6046b265680b1","evidence.schema":"1","evidence.science_blake3":"ee277da394abeff482ea24ef024eeafd9027988c8d589420e84d93c123a771f0","manifest_blake3":"7a87c37147f003379e6b63b8be48360691c1e43b4e7c4ab25e331a6b06261af2","outcome.rows":"4","pileup.semantics":"exact-or-fail-v1","run_status":"completed","rustc_version":"rustc 1.95.0 (59807616e 2026-04-14)","schema_version":"5","target_triple":"aarch64-apple-darwin"},"subcommand":"dataset evidence","tool_version":"0.3.0"}