{"inputs":[{"blake3":"1111111111111111111111111111111111111111111111111111111111111111","path":"/legacy/input.bam"}],"measurements":{"contract_verdict":"within","measurement_blake3":"d1ef666dae7bb9ac85dfa031d032245c23afe3bc429ef751610de390dcee2d24","peak_rss_bytes":"33554432"},"outputs":[{"blake3":"2222222222222222222222222222222222222222222222222222222222222222","path":"/legacy/output.vcf"}],"params":{"code_dirty":"false","code_git_sha":"aaaaaaaaaaaaaaaaaaaaaaaaaaaaaaaaaaaaaaaa","command":"variants --alignments @in:1111111111111111111111111111111111111111111111111111111111111111 -o @out:2222222222222222222222222222222222222222222222222222222222222222","deps_lock_blake3":"bbbbbbbbbbbbbbbbbbbbbbbbbbbbbbbbbbbbbbbbbbbbbbbbbbbbbbbbbbbbbbbb","has_measurements":"true","manifest_blake3":"8ecac50e2997b8612f3b2509bd9793999d4a0c8595201341feada386c2ed5c38","memory_budget_mb":"128","rustc_version":"rustc fixture","schema_version":"5","target_triple":"x86_64-unknown-linux-gnu"},"subcommand":"variants","tool_version":"0.1.0"}
